ORF,Gene,"SGD annotation",Function,Subgroup
YIL002C,INP51,"Phosphatidylinositol 4,5-bisphosphate 5-phosphatase, synaptojanin-like protein with an N-terminal Sac1 domain, plays a role in phosphatidylinositol 4,5-bisphosphate homeostasis and in endocytosis; null mutation confers cold-tolerant growth","non-protein phosphatase",
YJL155C,FBP26,"Fructose-2,6-bisphosphatase, required for glucose metabolism","non-protein phosphatase",
YJR110W,YMR1,"Phosphatidylinositol 3-phosphate [PI(3)P] phosphatase, regulates the localization and levels of PI(3)P; involved in cytoplasm to vacuole (CVT) transport; has similarity to the conserved myotubularin dual specificity phosphatase family","non-protein phosphatase",
YKL212W,SAC1,"Lipid phosphoinositide phosphatase of the ER and Golgi, involved in protein trafficking and secretion","non-protein phosphatase",
YKR053C,YSR3,"Dihydrosphingosine 1-phosphate phosphatase, membrane protein involved in sphingolipid metabolism; has similarity to Lcb3p","non-protein phosphatase",
YLR151C,PCD1,"Peroxisomal nudix pyrophosphatase with specificity for coenzyme A and CoA derivatives, may function to remove potentially toxic oxidized CoA disulfide from peroxisomes to maintain the capacity for beta-oxidation of fatty acids","non-protein phosphatase",
YLR377C,FBP1,"Fructose-1,6-bisphosphatase, key regulatory enzyme in the gluconeogenesis pathway, required for glucose metabolism","non-protein phosphatase",
YMR156C,TPP1,"DNA 3'-phosphatase that functions in repair of endogenous damage of double-stranded DNA, activity is specific for removal of 3' phosphates at strand breaks; has similarity to the l-2-haloacid dehalogenase superfamily","non-protein phosphatase",
YMR180C,CTL1,"RNA 5'-triphosphatase, localizes to both the nucleus and cytoplasm","non-protein phosphatase",
YMR267W,PPA2,"Mitochondrial inorganic pyrophosphatase, required for mitochondrial function and possibly involved in energy generation from inorganic pyrophosphate","non-protein phosphatase",
YNL106C,INP52,"Phosphatidylinositol 4,5-bisphosphate 5-phosphatase, synaptojanin-like protein with an N-terminal Sac1 domain, plays a role in endocytosis; hyperosmotic stress causes translocation to actin patches","non-protein phosphatase",
YNL128W,TEP1,"Homolog of human tumor suppressor gene PTEN/MMAC1/TEP1 that has lipid phosphatase activity and is linked to the phosphatidylinositol signaling pathway; plays a role in normal sporulation","non-protein phosphatase",
YNL325C,FIG4,"Protein required for efficient mating, member of a family of eukaryotic proteins that contain a domain homologous to Sac1p","non-protein phosphatase",
YOL065C,INP54,"Phosphatidylinositol 4,5-bisphosphate 5-phosphatase with a role in secretion, localizes to the endoplasmic reticulum via the C-terminal tail; lacks the Sac1 domain and proline-rich region found in the other 3 INP proteins","non-protein phosphatase",
YOR109W,INP53,"Phosphatidylinositol 4,5-bisphosphate 5-phosphatase, synaptojanin-like protein with an N-terminal Sac1 domain, plays a role in a TGN (trans Golgi network)-to-early endosome pathway; hyperosmotic stress causes translocation to actin patches","non-protein phosphatase",
YDR245W,MNN10,"Subunit of a Golgi mannosyltransferase complex also containing Anp1p, Mnn9p, Mnn11p, and Hoc1p that mediates elongation of the polysaccharide mannan backbone; membrane protein of the mannosyltransferase family ",other,"cell wall organization"
YJL183W,MNN11,"Subunit of a Golgi mannosyltransferase complex that also contains Anp1p, Mnn9p, Mnn10p, and Hoc1p, and mediates elongation of the polysaccharide mannan backbone; has homology to Mnn10p",other,"cell wall organization"
YAR003W,SWD1,"Subunit of the COMPASS (Set1C) complex, which methylates histone H3 on lysine 4 and is required in transcriptional silencing near telomeres; WD40 beta propeller superfamily member with similarity to mammalian Rbbp7 ",other,"chromatin binding and remodeling"
YBR095C,RXT2,"Subunit of the histone deacetylase Rpd3L complex; possibly involved in cell fusion and invasive growth",other,"chromatin binding and remodeling"
YBR175W,SWD3,"Essential subunit of the COMPASS (Set1C) complex, which methylates histone H3 on lysine 4 and is required in transcriptional silencing near telomeres; WD40 beta propeller superfamily member and ortholog of mammalian WDR5 ",other,"chromatin binding and remodeling"
YDR334W,SWR1,"Swi2/Snf2-related ATPase that is the structural component of the SWR1 complex, which exchanges histone variant H2AZ (Htz1p) for chromatin-bound histone H2A ",other,"chromatin binding and remodeling"
YDR485C,VPS72,"Htz1p-binding component of the SWR1 complex, which exchanges histone variant H2AZ (Htz1p) for chromatin-bound histone H2A; required for vacuolar protein sorting ",other,"chromatin binding and remodeling"
YER092W,IES5,"Protein that associates with the INO80 chromatin remodeling complex under low-salt conditions ",other,"chromatin binding and remodeling"
YJL115W,ASF1,"Nucleosome assembly factor, involved in chromatin assembly and disassembly, anti-silencing protein that causes derepression of silent loci when overexpressed ",other,"chromatin binding and remodeling"
YLR052W,IES3,"Subunit of the INO80 chromatin remodeling complex ",other,"chromatin binding and remodeling"
YML041C,VPS71,"Nucleosome-binding component of the SWR1 complex, which exchanges histone variant H2AZ (Htz1p) for chromatin-bound histone H2A; required for vacuolar protein sorting ",other,"chromatin binding and remodeling"
YMR219W,ESC1,"Protein localized to the nuclear periphery, involved in telomeric silencing; interacts with PAD4-domain of Sir4p ",other,"chromatin binding and remodeling"
YNL135C,FPR1,"Peptidyl-prolyl cis-trans isomerase (PPIase), binds to the drugs FK506 and rapamycin; also binds to the nonhistone chromatin binding protein Hmo1p and may regulate its assembly or function",other,"chromatin binding and remodeling"
YOL012C,HTZ1,"Histone variant H2AZ, exchanged for histone H2A in nucleosomes by the SWR1 complex; involved in transcriptional regulation through prevention of the spread of silent heterochromatin ",other,"chromatin binding and remodeling"
YPL181W,CTI6,"Protein that relieves transcriptional repression by binding to the Cyc8p-Tup1p corepressor and recruiting the SAGA complex to the repressed promoter; contains a PHD finger domain ",other,"chromatin binding and remodeling"
YCL016C,DCC1,"Subunit of a complex with Ctf8p and Ctf18p that shares some components with Replication Factor C, required for sister chromatid cohesion and telomere length maintenance ",other,"chromosome segregation"
YDR318W,MCM21,"Protein involved in minichromosome maintenance; component of the COMA complex (Ctf19p, Okp1p, Mcm21p, Ame1p) that bridges kinetochore subunits that are in contact with centromeric DNA and the subunits bound to microtubules ",other,"chromosome segregation"
YHR191C,CTF8,"Subunit of a complex with Ctf18p that shares some subunits with Replication Factor C and is required for sister chromatid cohesion ",other,"chromosome segregation"
YLR190W,MMR1,"Phosphorylated protein of the mitochondrial outer membrane, localizes only to mitochondria of the bud; interacts with Myo2p to mediate mitochondrial distribution to buds; mRNA is targeted to the bud via the transport system involving She2p ",other,"chromosome segregation"
YMR048W,CSM3,"Protein required for accurate chromosome segregation during meiosis ",other,"chromosome segregation"
YOR349W,CIN1,"Tubulin folding factor D involved in beta-tubulin (Tub2p) folding; isolated as mutant with increased chromosome loss and sensitivity to benomyl ",other,"chromosome segregation"
YPL241C,CIN2,"Tubulin folding factor C (putative) involved in beta-tubulin (Tub2p) folding; isolated as mutant with increased chromosome loss and sensitivity to benomyl ",other,"chromosome segregation"
YPR046W,MCM16,"Protein involved in kinetochore-microtubule mediated chromosome segregation; binds to centromere DNA",other,"chromosome segregation"
YML124C,TUB3,"Alpha-tubulin; associates with beta-tubulin (Tub2p) to form tubulin dimer, which polymerizes to form microtubules; expressed at lower level than Tub1p ",other,"chromosome segregation"
YNL312W,RFA2,"Subunit of heterotrimeric Replication Protein A (RPA), which is a highly conserved single-stranded DNA binding protein involved in DNA replication, repair, and recombination ",other,"DNA replication/repair"
YOL006C,TOP1,"Topoisomerase I, nuclear enzyme that relieves torsional strain in DNA by cleaving and re-sealing the phosphodiester backbone; relaxes both positively and negatively supercoiled DNA; functions in replication, transcription, and recombination ",other,"DNA replication/repair"
YER095W,RAD51,"Strand exchange protein, forms a helical filament with DNA that searches for homology; involved in the recombinational repair of double-strand breaks in DNA during vegetative growth and meiosis; homolog of Dmc1p and bacterial RecA protein ",other,"DNA replication/repair"
YGL127C,SOH1,"Subunit of the RNA polymerase II mediator complex; associates with core polymerase subunits to form the RNA polymerase II holoenzyme; involved in telomere maintenance; conserved with other metazoan MED31 subunits ",other,"DNA replication/repair"
YKL113C,RAD27,"5' to 3' exonuclease, 5' flap endonuclease, required for Okazaki fragment processing and maturation as well as for long-patch base-excision repair; member of the S. pombe RAD2/FEN1 family ",other,"DNA replication/repair"
YML032C,RAD52,"Protein that stimulates strand exchange by facilitating Rad51p binding to single-stranded DNA; anneals complementary single-stranded DNA; involved in the repair of double-strand breaks in DNA during vegetative growth and meiosis ",other,"DNA replication/repair"
YCL061C,MRC1,"S-phase checkpoint protein found at replication forks, required for DNA replication; also required for Rad53p activation during DNA replication stress, where it forms a replication-pausing complex with Tof1p and is phosphorylated by Mec1p; protein involved in replication checkpoint ",other,"DNA replication/repair"
YHR031C,RRM3,"DNA helicase involved in rDNA replication and Ty1 transposition; relieves replication fork pauses at telomeric regions; structurally and functionally related to Pif1p ",other,"DNA replication/repair"
YGR130C,,"Putative protein of unknown function; green fluorescent protein (GFP)-fusion protein localizes to the cytoplasm; specifically phosphorylated in vitro by mammalian diphosphoinositol pentakisphosphate (IP7)",other,"DNA replication/repair"
YMR207C,HFA1,"Mitochondrial acetyl-coenzyme A carboxylase, catalyzes the production of malonyl-CoA in mitochondrial fatty acid biosynthesis",other,"fatty acid biosynthesis"
YNR016C,ACC1,"Acetyl-CoA carboxylase, biotin containing enzyme that catalyzes the carboxylation of acetyl-CoA to form malonyl-CoA; required for de novo biosynthesis of long-chain fatty acids",other,"fatty acid biosynthesis"
YBR129C,OPY1,"Protein of unknown function, overproduction blocks cell cycle arrest in the presence of mating pheromone; the authentic, non-tagged protein is detected in highly purified mitochondria in high-throughput studies ",other,"pheromone response"
YDL090C,RAM1,"Beta subunit of the CAAX farnesyltransferase (FTase) that prenylates the a-factor mating pheromone and Ras proteins; required for the membrane localization of Ras proteins and a-factor; homolog of the mammalian FTase beta subunit",other,"pheromone response"
YER019W,ISC1,"Inositol phosphosphingolipid phospholipase C, hydrolyzes inositolphosphosphingolipids, activated by phosphatidylserine, cardiolipin, and phosphatidylglycerol, mediates Na+ and Li+ halotolerance, contains a P loop-like domain",other,"phospholipid metabolism"
YKR031C,SPO14,"Phospholipase D, catalyzes the hydrolysis of phosphatidylcholine, producing choline and phosphatidic acid; involved in Sec14p-independent secretion; required for meiosis and spore formation; differently regulated in secretion and meiosis",other,"phospholipid metabolism"
YML059C,NTE1,"Serine esterase that deacylates exogenous lysophospholipids, homolog of human neuropathy target esterase (NTE); mammalian NTE1 deacylates phosphatidylcholine to glycerophosphocholine",other,"phospholipid metabolism"
YMR006C,PLB2,"Phospholipase B (lysophospholipase) involved in phospholipid metabolism; displays transacylase activity in vitro; overproduction confers resistance to lysophosphatidylcholine",other,"phospholipid metabolism"
YMR008C,PLB1,"Phospholipase B (lysophospholipase) involved in lipid metabolism, required for deacylation of phosphatidylcholine and phosphatidylethanolamine but not phosphatidylinositol",other,"phospholipid metabolism"
YOL011W,PLB3,"Phospholipase B (lysophospholipase) involved in phospholipid metabolism; hydrolyzes phosphatidylinositol and phosphatidylserine and displays transacylase activity in vitro",other,"phospholipid metabolism"
YPL268W,PLC1,"Phosphoinositide-specific phospholipase C, hydrolyzes phosphatidylinositol 4,5-biphosphate (PIP2) to generate inositol 1,4,5-triphosphate (IP3) and 1,2-diacylglycerol (DAG); involved in kinetochore function and pseudohyphal differentiation",other,"phospholipid metabolism"
YBR030W,,"Hypothetical protein, contains FKH and INO binding sites",other,"phospholipid metabolism"
YDR096W,GIS1,"Transcriptional factor, involved in the expression of genes during nutrient limitation; also involved in the negative regulation of DPP1 and PHR1",other,"phospholipid metabolism"
YGL126W,SCS3,"Protein required for inositol prototrophy, appears to be involved in the synthesis of inositol phospholipids from inositol but not in the control of inositol synthesis",other,"phospholipid metabolism"
YHL020C,OPI1,"Transcriptional regulator of a variety of genes; phosphorylation by protein kinase A stimulates Opi1p function in negative regulation of phospholipid biosynthetic genes; involved in telomere maintenance",other,"phospholipid metabolism"
YJR073C,OPI3,"Phospholipid methyltransferase (methylene-fatty-acyl-phospholipid synthase), catalyzes the last two steps in phosphatidylcholine biosynthesis ",other,"phospholipid metabolism"
YKL051W,SFK1,"Plasma membrane protein that may act together with or upstream of Stt4p to generate normal levels of the essential phospholipid PI4P, at least partially mediates proper localization of Stt4p to the plasma membrane",other,"phospholipid metabolism"
YLR386W,VAC14,"Protein involved in regulated synthesis of PtdIns(3,5)P(2), in control of trafficking of some proteins to the vacuole lumen via the MVB, and in maintenance of vacuole size and acidity; activator of Fab1p",other,"phospholipid metabolism"
YNL054W,VAC7,"Integral vacuolar membrane protein involved in vacuole inheritance and morphology; may function to regulate Fab1p kinase activity",other,"phospholipid metabolism"
YER151C,UBP3,"Ubiquitin-specific protease that interacts with Bre5p to co-regulate anterograde and retrograde transport between endoplasmic reticulum and Golgi compartments; inhibitor of gene silencing; cleaves ubiquitin fusions but not polyubiquitin",other,"protein degradation"
YDR363W-A,SEM1,"Component of the lid subcomplex of the regulatory subunit of the 26S proteasome; ortholog of human DSS1 ",other,"protein degradation"
YHR200W,RPN10,"Non-ATPase base subunit of the 19S regulatory particle (RP) of the 26S proteasome; N-terminus plays a role in maintaining the structural integrity of the RP; binds selectively to polyubiquitin chains; homolog of the mammalian S5a protein ",other,"protein degradation"
YJL047C,RTT101,"Cullin subunit of a Roc1p-dependent E3 ubiquitin ligase complex; deletion phenotype suggests a role in anaphase progression; interacts with Mms22p and implicated in Mms22-dependent DNA repair; modified by the ubiquitin-like protein, Rub1p ",other,"protein degradation"
YKL213C,DOA1,"WD repeat protein required for ubiquitin-mediated protein degradation, forms complex with Cdc48p, plays a role in controlling cellular ubiquitin concentration; also promotes efficient NHEJ in postdiauxic/stationary phase ",other,"protein degradation"
YNR051C,BRE5,"Ubiquitin protease cofactor, forms deubiquitination complex with Ubp3p that coregulates anterograde and retrograde transport between the endoplasmic reticulum and Golgi compartments; null is sensitive to brefeldin A",other,"protein degradation"
YEL003W,GIM4,"Subunit of the heterohexameric cochaperone prefoldin complex which binds specifically to cytosolic chaperonin and transfers target proteins to it ",other,"protein trafficking"
YML094W,GIM5,"Subunit of the heterohexameric cochaperone prefoldin complex which binds specifically to cytosolic chaperonin and transfers target proteins to it ",other,"protein trafficking"
YNL153C,GIM3,"Subunit of the heterohexameric cochaperone prefoldin complex which binds specifically to cytosolic chaperonin and transfers target proteins to it ",other,"protein trafficking"
YGR086C,PIL1,"Primary component of eisosomes, which are large immobile cell cortex structures associated with endocytosis; null mutants show activation of Pkc1p/Ypk1p stress resistance pathways; detected in phosphorylated state in mitochondria ",other,"protein trafficking"
YPL004C,LSP1,"Primary component of eisosomes, which are large immobile patch structures at the cell cortex associated with endocytosis, along with Pil1p and Sur7p; null mutants show activation of Pkc1p/Ypk1p stress resistance pathways ",other,"protein trafficking"
YBR164C,ARL1,"Soluble GTPase with a role in regulation of membrane traffic; regulates potassium influx; G protein of the Ras superfamily, similar to ADP-ribosylation factor ",other,"protein trafficking"
YJL004C,SYS1,"Integral membrane protein of the Golgi required for targeting of the Arf-like GTPase Arl3p to the Golgi; multicopy suppressor of ypt6 null mutation ",other,"protein trafficking"
YLR262C,YPT6,"GTPase, Ras-like GTP binding protein involved in the secretory pathway, required for fusion of endosome-derived vesicles with the late Golgi, maturation of the vacuolar carboxypeptidase Y; has similarity to the human GTPase, Rab6 ",other,"protein trafficking"
YAR002W,NUP60,"Subunit of the nuclear pore complex (NPC), functions to anchor Nup2p to the NPC in a process controlled by the nucleoplasmic concentration of Gsp1p-GTP; potential Cdc28p substrate; involved in telomere maintenance ",other,"protein trafficking"
YDL116W,NUP84,"Subunit of the nuclear pore complex (NPC), forms a subcomplex with Nup85p, Nup120p, Nup145p-C, Sec13p, and Seh1p that plays a role in nuclear mRNA export and NPC biogenesis ",other,"protein trafficking"
YER083C,GET2,"Subunit of the GET complex; required for meiotic nuclear division and for the retrieval of HDEL proteins from the Golgi to the ER in an ERD2 dependent fashion; may be involved in cell wall function",other,"protein trafficking"
YGL020C,GET1,"Subunit of the GET complex; required for the retrieval of HDEL proteins from the Golgi to the ER in an ERD2 dependent fashion and for normal mitochondrial morphology and inheritance ",other,"protein trafficking"
YGL124C,MON1,"Protein required for fusion of cvt-vesicles and autophagosomes with the vacuole; associates, as a complex with Ccz1p, with a perivacuolar compartment; potential Cdc28p substrate ",other,"protein trafficking"
YLR039C,RIC1,"Protein involved in retrograde transport to the cis-Golgi network; forms heterodimer with Rgp1p that acts as a GTP exchange factor for Ypt6p; involved in transcription of rRNA and ribosomal protein genes ",other,"protein trafficking"
YLR268W,SEC22,"R-SNARE protein; assembles into SNARE complex with Bet1p, Bos1p and Sed5p; cycles between the ER and Golgi complex; involved in anterograde and retrograde transport between the ER and Golgi; synaptobrevin homolog",other,"protein trafficking"
YNL041C,COG6,"Component of the conserved oligomeric Golgi complex (Cog1p through Cog8p), a cytosolic tethering complex that functions in protein trafficking to mediate fusion of transport vesicles to Golgi compartments ",other,"protein trafficking"
YNL051W,COG5,"Component of the conserved oligomeric Golgi complex (Cog1p through Cog8p), a cytosolic tethering complex that functions in protein trafficking to mediate fusion of transport vesicles to Golgi compartments ",other,"protein trafficking"
YGL174W,BUD13,"Subunit of the RES complex, which is required for nuclear pre-mRNA retention and splicing; involved in bud-site selection; diploid mutants display a unipolar budding pattern instead of the wild-type bipolar pattern ",other,"RNA processing"
YIR005W,IST3,"Component of the U2 snRNP, required for the first catalytic step of splicing and for spliceosomal assembly; interacts with Rds3p and is required for Mer1p-activated splicing",other,"RNA processing"
YKL074C,MUD2,"Protein involved in early pre-mRNA splicing; component of the pre-mRNA-U1 snRNP complex, the commitment complex; interacts with Msl5p/BBP splicing factor and Sub2p; similar to metazoan splicing factor U2AF65 ",other,"RNA processing"
YKL208W,CBT1,"Protein involved in 5' end processing of mitochondrial COB, 15S_rRNA, and RPM1 transcripts; may also have a role in 3' end processing of the COB pre-mRNA; displays genetic interaction with cell cycle-regulated kinase Dbf2p ",other,"RNA processing"
YPL213W,LEA1,"Component of U2 snRNP; disruption causes reduced U2 snRNP levels; physically interacts with Msl1p; invovled in telomere maintenance; putative homolog of human U2A' snRNP protein ",other,"RNA processing"
YDR378C,LSM6,"Lsm (Like Sm) protein; part of heteroheptameric complexes (Lsm2p-7p and either Lsm1p or 8p): cytoplasmic Lsm1p complex involved in mRNA decay; nuclear Lsm8p complex part of U6 snRNP and possibly involved in processing tRNA, snoRNA, and rRNA ",other,"RNA processing"
YGL213C,SKI8,"Protein involved in exosome mediated 3' to 5' mRNA degradation and translation inhibition of non-poly(A) mRNAs as well as double-strand break formation during meiotic recombination; required for repressing propagation of dsRNA viruses ",other,"RNA processing"
YJL124C,LSM1,"Lsm (Like Sm) protein; forms heteroheptameric complex (with Lsm2p, Lsm3p, Lsm4p, Lsm5p, Lsm6p, and Lsm7p) involved in degradation of cytoplasmic mRNAs ",other,"RNA processing"
YNL147W,LSM7,"Lsm (Like Sm) protein; part of heteroheptameric complexes (Lsm2p-7p and either Lsm1p or 8p): cytoplasmic Lsm1p complex involved in mRNA decay; nuclear Lsm8p complex part of U6 snRNP and possibly involved in processing tRNA, snoRNA, and rRNA ",other,"RNA processing"
YOR076C,SKI7,"Antiviral adaptor protein that mediates interactions via its N-terminus between the exosome and Ski complex (Ski2p, Ski3p, Ski8p) which operate in the 3'-to-5' mRNA-decay pathway; cytoplasmic protein required for degrading nonstop mRNAs ",other,"RNA processing"
YPR189W,SKI3,"Protein involved in exosome mediated 3' to 5' mRNA degradation and translation inhibition of non-poly(A) mRNAs; forms complex with Ski2p and Ski8p; required for repressing propagation of dsRNA viruses ",other,"RNA processing"
YGR081C,SLX9,"Protein required for pre-rRNA processing; associated with the 90S pre-ribosome and 43S small ribosomal subunit precursor; interacts with U3 snoRNA; deletion mutant has synthetic fitness defect with an sgs1 deletion mutant",other,"RNA processing"
YHR081W,LRP1,"Substrate-specific nuclear cofactor for exosome activity in the processing of stable RNAs; required for telomere length maintenance; homolog of mammalian nuclear matrix protein C1D involved in regulation of DNA repair and recombination ",other,"RNA processing"
YIL040W,APQ12,"Protein involved in nucleocytoplasmic transport of mRNA ",other,"RNA processing"
YMR287C,MSU1,"3'-5' exoribonuclease, component of the mitochondrial degradosome along with the ATP-dependent RNA helicase Suv3p; the degradosome associates with the ribosome and mediates turnover of aberrant or unprocessed RNAs",other,"RNA processing"
YNL098C,RAS2,"GTP-binding protein that regulates the nitrogen starvation response, sporulation, and filamentous growth; farnesylation and palmitoylation required for activity and localization to plasma membrane; homolog of mammalian Ras proto-oncogenes",other,"signal transduction"
YCR027C,RHB1,"Putative Rheb-related GTPase involved in regulating canavanine resistance and arginine uptake; member of the Ras superfamily of G-proteins",other,"signal transduction"
YOR101W,RAS1,"GTPase involved in G-protein signaling in the adenylate cyclase activating pathway, plays a role in cell proliferation; localized to the plasma membrane; homolog of mammalian RAS proto-oncogenes",other,"signal transduction"
YPL115C,BEM3,"Rho GTPase activating protein (RhoGAP) involved in control of the cytoskeleton organization; targets the essential Rho-GTPase Cdc42p, which controls establishment and maintenance of cell polarity, including bud-site assembly ",other,"signal transduction"
YDL235C,YPD1,"Phosphorelay intermediate protein, phosphorylated by the plasma membrane sensor Sln1p in response to osmotic stress and then in turn phosphorylates the response regulators Ssk1p in the cytosol and Skn7p in the nucleus",other,"signal transduction"
YDR072C,IPT1,"Inositolphosphotransferase 1, involved in synthesis of mannose-(inositol-P)2-ceramide (M(IP)2C), which is the most abundant sphingolipid in cells, mutation confers resistance to the antifungals syringomycin E and DmAMP1 in some growth media",other,"signal transduction"
YER118C,SHO1,"Transmembrane osmosensor, participates in activation of both the Cdc42p- and MAP kinase-dependent filamentous growth pathway and the high-osmolarity glycerol response pathway ",other,"signal transduction"
YLR006C,SSK1,"Cytoplasmic response regulator, part of a two-component signal transducer that mediates osmosensing via a phosphorelay mechanism; dephosphorylated form is degraded by the ubiquitin-proteasome system; potential Cdc28p substrate",other,"signal transduction"
