ORF,Gene,"SGD annotation",Function,Subgroup
YGL021W,ALK1,"Protein kinase; accumulation and phosphorylation are periodic during the cell cycle; phosphorylated in response to DNA damage; contains characteristic motifs for degradation via the APC pathway; similar to Alk2p and to mammalian haspins","protein kinase",
YGL059W,,"Hypothetical protein","protein kinase",
YGL083W,SCY1,"Protein involved in suppression of a GTPase mutant","protein kinase",
YGL158W,RCK1,"Protein kinase involved in the response to oxidative stress","protein kinase",
YGL179C,TOS3,"Protein kinase, related to and functionally redundant with Elm1p and Sak1p for the phosphorylation and activation of Snf1p","protein kinase",
YGL180W,ATG1,"Protein serine/threonine kinase, required for autophagy and for the cytoplasm-to-vacuole targeting (Cvt) pathway","protein kinase",
YGR040W,KSS1,"Mitogen-activated protein kinase (MAPK) involved in signal transduction pathways that control filamentous growth and pheromone response ","protein kinase",
YGR052W,FMP48,"The authentic, non-tagged protein was localized to the mitochondria","protein kinase",
YGR080W,TWF1,"Protein with similarity to human tyrosine kinase A6. Not in alignment.","protein kinase",
YGR092W,DBF2,"Ser/Thr kinase involved in transcription and stress response","protein kinase",
YGR188C,BUB1,"Protein kinase that forms a complex with Mad1p and Bub3p that is crucial in the checkpoint mechanism required to prevent cell cycle progression into anaphase in the presence of spindle damage, associates with centromere DNA via Skp1p","protein kinase",
YHL007C,STE20,"Signal transducing kinase of the PAK (p21-activated kinase) family, involved in pheromone response and pseudohyphal/invasive growth pathways, activated by Cdc42p","protein kinase",
YHR030C,SLT2,"Serine/threonine MAP kinase involved in regulating the maintenance of cell wall integrity and progression through the cell cycle","protein kinase",
YHR079C,IRE1,"Serine-threonine kinase and endoribonuclease","protein kinase",
YHR082C,KSP1,"Nonessential putative serine/threonine protein kinase of unknown cellular role","protein kinase",
YHR135C,YCK1,"Palmitoylated, plasma membrane-bound casein kinase I isoform","protein kinase",
YHR205W,SCH9,"Protein kinase that regulates signal transduction activity and G1 progression, controls cAPK activity, required for nitrogen activation of the FGM pathway, involved in life span regulation, homologous to mammalian Akt/PKB","protein kinase",
YIL035C,CKA1,"Alpha catalytic subunit of casein kinase 2, a Ser/Thr protein kinase with roles in cell growth and proliferation","protein kinase",
YIL042C,PKP1,"Mitochondrial kinase, phosphorylates pyruvate dehydrogenase alpha subunit Pda1p","protein kinase",
YIL095W,PRK1,"Protein serine/threonine kinase","protein kinase",
YIL147C,SLN1,"Histidine kinase osmosensor that regulates a MAP kinase cascade, transmembrane protein with an intracellular kinase domain that signals to Ypd1p and Ssk1p, thereby forming a phosphorelay system similar to bacterial two-component regulators","protein kinase",
YJL057C,IKS1,"Probable serine/threonine protein kinase, yeast specific","protein kinase",
YJL095W,BCK1,"Mitogen-activated protein (MAP) kinase kinase kinase acting in the protein kinase C signaling pathway, which controls cell integrity","protein kinase",
YJL106W,IME2,"Serine/threonine protein kinase involved in activation of meiosis, associates with Ime1p and mediates its stability, activates Ndt80p","protein kinase",
YJL141C,YAK1,"Serine-threonine protein kinase that is part of a glucose-sensing system involved in growth control in response to glucose availability","protein kinase",
YJL164C,TPK1,"Subunit of cytoplasmic cAMP-dependent protein kinase, which contains redundant catalytic subunits Tpk1p, Tpk2p, and Tpk3p and regulatory subunit Bcy1p","protein kinase",
YJL165C,HAL5,"Putative protein kinase","protein kinase",
YJL187C,"SWE1 (WEE1)","Protein kinase that regulates the G2/M transition by inhibition of Cdc28p kinase activity","protein kinase",
YJR059W,PTK2,"Putative serine/threonine protein kinase involved in regulation of ion transport across plasma membrane","protein kinase",
YJR066W,TOR1,"PIK-related protein kinase and rapamycin target","protein kinase",
YKL048C,ELM1,"Serine/threonine protein kinase that regulates cellular morphogenesis, septin behavior, and cytokinesis","protein kinase",
YKL101W,HSL1,"Nim1p-related protein kinase that regulates the morphogenesis and septin checkpoints","protein kinase",
YKL116C,PRR1,"Protein kinase with a possible role in MAP kinase signaling in the pheromone response pathway","protein kinase",
YKL126W,YPK1,"Serine/threonine protein kinase required for receptor-mediated endocytosis","protein kinase",
YKL139W,CTK1,"Catalytic (alpha) subunit of C-terminal domain kinase I (CTDK-I), which phosphorylates the C-terminal repeated domain of the RNA polymerase II large subunit (Rpo21p) to affect both transcription and pre-mRNA 3' end processing","protein kinase",
YKL161C,,"Protein kinase implicated in the Slt2p mitogen-activated (MAP) kinase signaling pathway","protein kinase",
YKL166C,TPK3,"Subunit of cytoplasmic cAMP-dependent protein kinase, which contains redundant catalytic subunits Tpk1p, Tpk2p, and Tpk3p and regulatory subunit Bcy1p","protein kinase",
YKL168C,KKQ8,"Putative serine/threonine protein kinase with unknown cellular role","protein kinase",
YKL171W,,"Putative protein of unknown function","protein kinase",
YKL198C,PTK1,"Putative serine/threonine protein kinase that regulates spermine uptake","protein kinase",
YKL203C,TOR2,"PIK-related protein kinase and rapamycin target","protein kinase",
YLR096W,KIN2,"Serine/threonine protein kinase involved in regulation of exocytosis","protein kinase",
YLR113W,HOG1,"Mitogen-activated protein kinase involved in osmoregulation via three independent osmosensors","protein kinase",
YLR248W,RCK2,"Protein kinase involved in the response to oxidative and osmotic stress","protein kinase",
YMR001C,CDC5,"Polo-like kinase with similarity to Xenopus Plx1 and S. pombe Plo1p","protein kinase",
YMR104C,YPK2,"Protein kinase with similarityto serine/threonine protein kinase Ypk1p","protein kinase",
YMR139W,RIM11,"Protein kinase required for signal transduction during entry into meiosis","protein kinase",
YMR216C,SKY1,"SR protein kinase (SRPK) involved in regulating proteins involved in mRNA metabolism and cation homeostasis","protein kinase",
YMR291W,,"Hypothetical protein","protein kinase",
YNL020C,ARK1,"Serine/threonine protein kinase involved in regulation of the cortical actin cytoskeleton","protein kinase",
YNL154C,YCK2,"Palmitoylated, plasma membrane-bound casein kinase I isoform","protein kinase",
YNL183C,NPR1,"Serine/threonine protein kinase involved in regulating transport systems for nitrogen nutrients under conditions of nitrogen catabolite derepression, yeast specific","protein kinase",
YNL207W,RIO2,"Essential serine kinase involved in the processing of the 20S pre-rRNA into mature 18S rRNA","protein kinase",
YNL298W,CLA4,"Cdc42p activated signal transducing kinase of the PAK (p21-activated kinase) family, involved in septin ring assembly and cytokinesis","protein kinase",
YNR031C,SSK2,"MAP kinase kinase kinase of the HOG1 mitogen-activated signaling pathway","protein kinase",
YNR047W,,"Putative protein kinase that, when overexpressed, interferes with pheromone-induced growth arrest","protein kinase",
YOL016C,CMK2,"Calmodulin-dependent protein kinase","protein kinase",
YOL045W,PSK2,"One of two (see also PSK1) PAS domain containing S/T protein kinases","protein kinase",
YOL100W,PKH2,"Serine/threonine protein kinase involved in sphingolipid-mediated signaling pathway that controls endocytosis, PKA-related","protein kinase",
YOL113W,SKM1,"Member of the PAK family of serine/threonine protein kinases with similarity to Ste20p and Cla4p","protein kinase",
YOL128C,YGK3,"Protein kinase related to mammalian glycogen synthase kinases of the GSK-3 family","protein kinase",
YOR061W,CKA2,"Alpha' catalytic subunit of casein kinase 2, a Ser/Thr protein kinase with roles in cell growth and proliferation","protein kinase",
YOR119C,RIO1,"Essential serine kinase involved in cell cycle progression and processing of the 20S pre-rRNA into mature 18S rRNA","protein kinase",
YOR233W,KIN4,"Kinase that acts by inhibiting the mitotic exit network (MEN) when the spindle position checkpoint is activated","protein kinase",
YOR267C,HRK1,"Protein kinase implicated in activation of the plasma membrane H(+)-ATPase Pma1p in response to glucose metabolism","protein kinase",
YOR351C,MEK1,"Meiosis-specific serine/threonine protein kinase, functions in meiotic checkpoint, phosphorylates Red1p, interacts with Hop1p","protein kinase",
YPL026C,SKS1,"Putative serine/threonine protein kinase","protein kinase",
YPL031C,PHO85,"Cyclin-dependent kinase, with ten cyclin partners","protein kinase",
YPL042C,SSN3,"Cyclin-dependent protein kinase, component of RNA polymerase II holoenzyme","protein kinase",
YPL109C,,"Protein with unknown function, microbial protein kinase","protein kinase",
YPL141C,,"Serine/threonine protein kinase with similarity to Kin4p","protein kinase",
YPL150W,,"Hypothetical protein","protein kinase",
YPL153C,RAD53,"Protein kinase, required for cell-cycle arrest in response to DNA damage","protein kinase",
YPL203W,TPK2,"Subunit of cytoplasmic cAMP-dependent protein kinase, which contains redundant catalytic subunits Tpk1p, Tpk2p, and Tpk3p and regulatory subunit Bcy1p","protein kinase",
YPL204W,HRR25,"Protein kinase involved in regulating diverse events including vesicular trafficking, gene expression, DNA repair, and chromosome segregation","protein kinase",
YPL209C,IPL1,"Aurora kinase involved in regulating kinetochore-microtubule attachments, associates with Sli15p, which stimulates Ipl1p kinase activity and promotes its association with the mitotic spindle, potential Cdc28p substrate","protein kinase",
YPL236C,,"Hypothetical protein","protein kinase",
YPR054W,SMK1,"Middle sporulation-specific mitogen-activated protein kinase (MAPK) required for spore morphogenesis","protein kinase",
YPR106W,ISR1,"Predicted protein kinase, overexpression causes sensitivity to staurosporine, which is a potent inhibitor of protein kinase C","protein kinase",
YPR111W,DBF20,"Ser/Thr kinase involved in late nuclear division, one of the mitotic exit network (MEN) proteins","protein kinase",
YPR161C,SGV1,"Cyclin (Bur2p)-dependent protein kinase that functions in transcriptional regulation","protein kinase",
YDL028C,MPS1,"Dual-specificity kinase required for spindle pole body (SPB) duplication and spindle checkpoint function","protein kinase",
YJL128C,PBS2,"MAP kinase kinase that plays a pivotal role in the osmosensing signal-transduction pathway, activated under severe osmotic stress","protein kinase",
YLL019C,KNS1,"Nonessential putative protein kinase of unknown cellular role","protein kinase",
YNL307C,MCK1,"Protein serine/threonine/tyrosine (dual-specificity) kinase involved in control of chromosome segregation and in regulating entry into meiosis","protein kinase",
YOR231W,MKK1,"Mitogen-activated kinase kinase involved in protein kinase C signaling pathway that controls cell integrity","protein kinase",
YPL140C,MKK2,"Mitogen-activated kinase kinase involved in protein kinase C signaling pathway that controls cell integrity","protein kinase",
YBL056W,PTC3,"Type 2C protein phosphatase","protein phosphatase",
YBR125C,PTC4,"Cytoplasmic type 2C protein phosphatase","protein phosphatase",
YBR276C,PPS1,"Protein phosphatase with specificity for serine, threonine, and tyrosine residues","protein phosphatase",
YCR079W,PTC6,"Hypothetical protein","protein phosphatase",
YCR095C,OCA4,"Cytoplasmic protein required for replication of Brome mosaic virus in S. cerevisiae, which is a model system for studying replication of positive-strand RNA viruses in their natural hosts","protein phosphatase",
YDL006W,PTC1,"Type 2C protein phosphatase (PP2C)","protein phosphatase",
YDL047W,SIT4,"Type 2A-related serine-threonine phosphatase that functions in the G1/S transition of the mitotic cycle","protein phosphatase",
YDL134C,PPH21,"Catalytic subunit of protein phosphatase 2A, functionally redundant with Pph22p","protein phosphatase",
YDL188C,PPH22,"Catalytic subunit of protein phosphatase 2A, functionally redundant with Pph21p","protein phosphatase",
YDL230W,PTP1,"Phosphotyrosine-specific protein phosphatase that dephosphorylates a broad range of substrates in vivo, including Fpr3p","protein phosphatase",
YDR075W,PPH3,"Catalytic subunit of protein phosphatase","protein phosphatase",
YDR436W,PPZ2,"Serine/threonine protein phosphatase Z, isoform of Ppz1p","protein phosphatase",
YER075C,PTP3,"Phosphotyrosine-specific protein phosphatase involved in the inactivation of mitogen-activated protein kinase (MAPK) during osmolarity sensing","protein phosphatase",
YER089C,PTC2,"Type 2C protein phosphatase","protein phosphatase",
YER134C,,"Hypothetical protein","protein phosphatase",
YGR123C,PPT1,"Protein serine/threonine phosphatase with similarity to human phosphatase PP5","protein phosphatase",
YGR203W,,"Putative protein with sequence similarity to protein tyrosine phosphatases of the CDC25-like phosphatase family","protein phosphatase",
YHR076W,PTC7,"Mitochondrially localized type 2C protein phosphatase","protein phosphatase",
YIL113W,SDP1,"Stress-inducible dual-specificity MAP kinase phosphatase, negatively regulates Slt2p MAP kinase by direct dephosphorylation, diffuse localization under normal conditions shifts to punctate localization after heat shock","protein phosphatase",
YIR026C,YVH1,"Protein phosphatase involved in vegetative growth at low temperatures, sporulation, and glycogen accumulation","protein phosphatase",
YLL010C,PSR1,"Plasma membrane associated protein phosphatase involved in the general stress response","protein phosphatase",
YLR019W,PSR2,"Functionally redundant Psr1p homolog, a plasma membrane phosphatase involved in the general stress response","protein phosphatase",
YLR433C,CNA1,"Calcineurin A","protein phosphatase",
YML016C,PPZ1,"Serine/threonine protein phosphatase Z, isoform of Ppz2p","protein phosphatase",
YML057W,CMP2,"Calcineurin A","protein phosphatase",
YMR036C,MIH1,"Protein tyrosine phosphatase involved in cell cycle control","protein phosphatase",
YMR277W,FCP1,"Carboxy-terminal domain (CTD) phosphatase, essential for dephosphorylation of the repeated C-terminal domain of the RNA polymerase II large subunit (Rpo21p)","protein phosphatase",
YNL032W,"SIW14 (OCA3)","Tyrosine phosphatase that plays a role in actin filament organization and endocytosis","protein phosphatase",
YNL053W,MSG5,"Dual-specificity protein phosphatase required for maintenance of a low level of signaling through the cell integrity pathway","protein phosphatase",
YNL056W,OCA2,"Putative protein with similarity to predicted tyrosine phosphatases Oca1p and Siw14p; green fluorescent protein (GFP)-fusion protein localizes to the cytoplasm; YNL056W is not an essential gene","protein phosphatase",
YNL099C,OCA1,"Putative protein tyrosine phosphatase, required for cell cycle arrest in response to oxidative damage of DNA","protein phosphatase",
YNL217W,,"Protein of unknown function, similarity to PP2A family","protein phosphatase",
YNL222W,SSU72,"Transcription/RNA-processing factor that associates with TFIIB and cleavage/polyadenylation factor Pta1p","protein phosphatase",
YNR032W,PPG1,"Putative serine/threonine protein phosphatase, required for glycogen accumulation","protein phosphatase",
YOR090C,PTC5,"Mitochondrially localized type 2C protein phosphatase","protein phosphatase",
YOR208W,PTP2,"Phosphotyrosine-specific protein phosphatase involved in the inactivation of mitogen-activated protein kinase (MAPK) during osmolarity sensing","protein phosphatase",
YPL179W,"PPQ1 (SAL6)","Putative protein serine/threonine phosphatase","protein phosphatase",
YPR073C,LTP1,"Protein phosphotyrosine phosphatase of unknown cellular role","protein phosphatase",
