ORF,Gene,"SGD annotation",Function,Subgroup
YNL309W,STB1,"Protein with a role in regulation of MBF-specific transcription at Start, phosphorylated by Cln-Cdc28p kinases in vitro; unphosphorylated form binds Swi6p and binding is required for Stb1p function; expression is cell-cycle regulated ",other,transcription
YDR156W,RPA14,"RNA polymerase I subunit A14 ",other,transcription
YGR200C,ELP2,"Subunit of Elongator complex, which is required for modification of wobble nucleosides in tRNA; target of Kluyveromyces lactis zymocin ",other,transcription
YGR274C,TAF1,"TFIID subunit (145 kDa), involved in RNA polymerase II transcription initiation, has histone acetyltransferase activity, involved in promoter binding and G1/S progression",other,transcription
YJL148W,RPA34,"RNA polymerase I subunit A34.5",other,transcription
YJL168C,SET2,"Histone methyltransferase with a role in transcriptional elongation, methylates a lysine residue of histone H3; associates with the C-terminal domain of Rpo21p; histone methylation activity is regulated by phosphorylation status of Rpo21p ",other,transcription
YPR023C,EAF3,"Esa1p-associated factor, nonessential component of the NuA4 acetyltransferase complex, homologous to Drosophila dosage compensation protein MSL3 ",other,transcription
YAL051W,OAF1,"Oleate-activated transcription factor, acts alone and as a heterodimer with Pip2p; activates genes involved in beta-oxidation of fatty acids and peroxisome organization and biogenesis ",other,transcription
YBL005W,PDR3,"Transcriptional activator of the pleiotropic drug resistance network, regulates expression of ATP-binding cassette (ABC) transporters through binding to cis-acting sites known as PDREs (PDR responsive elements)",other,transcription
YBL103C,RTG3,"Basic helix-loop-helix-leucine zipper (bHLH/Zip) transcription factor that forms a complex with another bHLH/Zip protein, Rtg1p, to activate the retrograde (RTG) and TOR pathways ",other,transcription
YBR083W,TEC1,"Transcription factor required for full Ty1 epxression, Ty1-mediated gene activation, and haploid invasive and diploid pseudohyphal growth; TEA/ATTS DNA-binding domain family member ",other,transcription
YBR112C,CYC8,"General transcriptional co-repressor, acts together with Tup1p; also acts as part of a transcriptional co-activator complex that recruits the SWI/SNF and SAGA complexes to promoters ",other,transcription
YBR182C,SMP1,"Putative transcription factor involved in regulating the response to osmotic stress; member of the MADS-box family of transcription factors ",other,transcription
YCL055W,KAR4,"Transcription factor required for gene regulation in repsonse to pheromones; also required during meiosis; exists in two forms, a slower-migrating form more abundant during vegetative growth and a faster-migrating form induced by pheromone ",other,transcription
YDL056W,MBP1,"Transcription factor involved in regulation of cell cycle progression from G1 to S phase, forms a complex with Swi6p that binds to MluI cell cycle box regulatory element in promoters of DNA synthesis genes ",other,transcription
YDR146C,SWI5,"Transcription factor that activates transcription of genes expressed at the M/G1 phase boundary and in G1 phase; localization to the nucleus occurs during G1 and appears to be regulated by phosphorylation by Cdc28p kinase ",other,transcription
YER111C,SWI4,"DNA binding component of the SBF complex (Swi4p-Swi6p), a transcriptional activator that in concert with MBF (Mbp1-Swi6p) regulates late G1-specific transcription of targets including cyclins and genes required for DNA synthesis and repair ",other,transcription
YFL031W,HAC1,"bZIP transcription factor (ATF/CREB1 homolog) that regulates the unfolded protein response, via UPRE binding, and membrane biogenesis; ER stress-induced splicing pathway utilizing Ire1p, Trl1p and Ada5p facilitates efficient Hac1p synthesis ",other,transcription
YFR034C,PHO4,"Basic helix-loop-helix (bHLH) transcription factor of the myc-family; binds cooperatively with Pho2p to the PHO5 promoter; function is regulated by phosphorylation at multiple sites and by phosphate availability",other,transcription
YGL013C,PDR1,"Zinc cluster protein that is a master regulator involved in recruiting other zinc cluster proteins to pleiotropic drug response elements (PDREs) to fine tune the regulation of multidrug resistance genes",other,transcription
YGL035C,MIG1,"Transcription factor involved in glucose repression; sequence specific DNA binding protein containing two Cys2His2 zinc finger motifs; regulated by the SNF1 kinase and the GLC7 phosphatase ",other,transcription
YGL166W,CUP2,"Copper-binding transcription factor; activates transcription of the metallothionein genes CUP1-1 and CUP1-2 in response to elevated copper concentrations ",other,transcription
YHR124W,NDT80,"Meiosis-specific transcription factor required for exit from pachytene and for full meiotic recombination; activates middle sporulation genes; competes with Sum1p for binding to promoters containing middle sporulation elements (MSE)",other,transcription
YHR206W,SKN7,"Nuclear response regulator and transcription factor, part of a branched two-component signaling system; required for optimal induction of heat-shock genes in response to oxidative stress; involved in osmoregulation",other,transcription
YJL089W,SIP4,"C6 zinc cluster transcriptional activator that binds to the carbon source-responsive element (CSRE) of gluconeogenic genes; involved in the positive regulation of gluconeogenesis; regulated by Snf1p protein kinase; localized to the nucleus ",other,transcription
YJR094C,IME1,"Master regulator of meiosis that is active only during meiotic events, activates transcription of early meiotic genes through interaction with Ume6p, degraded by the 26S proteasome following phosphorylation by Ime2p ",other,transcription
YKR099W,BAS1,"Myb-related transcription factor involved in regulating basal and induced expression of genes of the purine and histidine biosynthesis pathways; also involved in regulation of meiotic recombination at specific genes ",other,transcription
YLR182W,SWI6,"Transcription cofactor, forms complexes with DNA-binding proteins Swi4p and Mbp1p to regulate transcription at the G1/S transition; involved in meiotic gene expression; localization regulated by phosphorylation; potential Cdc28p substrate ",other,transcription
YML007W,YAP1,"Basic leucine zipper (bZIP) transcription factor required for oxidative stress tolerance; activated by H2O2 through the multistep formation of disulfide bonds and transit from the cytoplasm to the nucleus; mediates resistance to cadmium ",other,transcription
YNL027W,CRZ1,"Transcription factor that activates transcription of genes involved in stress response; nuclear localization is positively regulated by calcineurin-mediated dephosphorylation ",other,transcription
YNR009W,NRM1,"Transcriptional co-repressor of MBF (MCB binding factor)-regulated gene expression; Nrm1p associates stably with promoters via MBF to repress transcription upon exit from G1 phase ",other,transcription
YOL067C,RTG1,"Transcription factor (bHLH) involved in interorganelle communication between mitochondria, peroxisomes, and nucleus ",other,transcription
YOR028C,CIN5,"Basic leucine zipper transcriptional factor of the yAP-1 family that mediates pleiotropic drug resistance and salt tolerance; localizes constitutively to the nucleus ",other,transcription
YOR083W,WHI5,"Repressor of G1 transcription that binds to SCB binding factor (SBF) at SCB target promoters in early G1; phosphorylation of Whi5p by the CDK, Cln3p/Cdc28p relieves repression and promoter binding by Whi5; periodically expressed in G1 ",other,transcription
YOR140W,SFL1,"Transcriptional repressor and activator; involved in repression of flocculation-related genes, and activation of stress responsive genes; negatively regulated by cAMP-dependent protein kinase A subunit Tpk2p ",other,transcription
YPL086C,ELP3,"Subunit of Elongator complex, which is required for modification of wobble nucleosides in tRNA; exhibits histone acetyltransferase activity that is directed to histones H3 and H4; disruption confers resistance to K. lactis zymotoxin ",other,transcription
YDR216W,ADR1,"Carbon source-responsive zinc-finger transcription factor, required for transcription of the glucose-repressed gene ADH2, of peroxisomal protein genes, and of genes required for ethanol, glycerol, and fatty acid utilization",other,transcription
YDR435C,PPM1,"Carboxyl methyl transferase, methylates the C terminus of the protein phosphatase 2A catalytic subunit (Pph21p or Pph22p), which is important for complex formation with regulatory subunits","phosphatase regulatory protein",
YAR014C,BUD14,"Protein involved in bud-site selection, Bud14p-Glc7p complex functions as a cortical regulator of dynein; diploid mutants display a random budding pattern instead of the wild-type bipolar pattern","phosphatase regulatory protein",
YBL046W,PSY4,"Putative protein of unknown function; green fluorescent protein (GFP)-fusion protein localizes to the nucleus","phosphatase regulatory protein",
YBR126C,TPS1,"Synthase subunit of trehalose-6-phosphate synthase/phosphatase complex, which synthesizes the storage carbohydrate trehalose; also found in a monomeric form; expression is induced by the stress response and repressed by the Ras-cAMP pathway","phosphatase regulatory protein",
YCR073W-A,SOL2,"Protein with a possible role in tRNA export; shows similarity to 6-phosphogluconolactonase non-catalytic domains but does not exhibit this enzymatic activity; homologous to Sol1p, Sol3p, and Sol4p","phosphatase regulatory protein",
YDR028C,"REG1 (HEX2, PZF240, SPP43, SRN1)","Regulatory subunit of type 1 protein phosphatase Glc7p, involved in negative regulation of glucose-repressible genes","phosphatase regulatory protein",
YDR067C,OCA6,"Cytoplasmic protein required for replication of Brome mosaic virus in S. cerevisiae, which is a model system for studying replication of positive-strand RNA viruses in their natural hosts","phosphatase regulatory protein",
YDR293C,"SSD1 (CLA1, MCS1, RLT1, SRK1) ","Protein with a role in maintenance of cellular integrity, interacts with components of the TOR pathway; ssd1 mutant of a clinical S. cerevisiae strain displays elevated virulence","phosphatase regulatory protein",
YDR475C,"JIP4 (YDR474C)","Protein of unknown function; previously annotated as two separate ORFs, YDR474C and YDR475C, which were merged as a result of corrections to the systematic reference sequence","phosphatase regulatory protein",
YFR040W,SAP155,"Protein that forms a complex with the Sit4p protein phosphatase and is required for its function","phosphatase regulatory protein",
YGL190C,CDC55,"Non-essential regulatory subunit B of protein phosphatase 2A","phosphatase regulatory protein",
YGL229C,SAP4,"Protein required for function of the Sit4p protein phosphatase, member of a family of similar proteins that form complexes with Sit4p, including Sap155p, Sap185p, and Sap190p","phosphatase regulatory protein",
YGR161C,RTS3,"Putative component of the protein phosphatase type 2A complex","phosphatase regulatory protein",
YHL029C,OCA5,"Cytoplasmic protein required for replication of Brome mosaic virus in S. cerevisiae, which is a model system for studying replication of positive-strand RNA viruses in their natural hosts","phosphatase regulatory protein",
YHR075C,PPE1,"Protein with carboxyl methyl esterase activity that may have a role in demethylation of the phosphoprotein phosphatase catalytic subunit; also identified as a small subunit mitochondrial ribosomal protein","phosphatase regulatory protein",
YIL045W,PIG2,"Putative type-1 protein phosphatase targeting subunit that tethers Glc7p type-1 protein phosphatase to Gsy2p glycogen synthase","phosphatase regulatory protein",
YIL153W,"RRD1 (YPA1)","Activator of the phosphotyrosyl phosphatase activity of PP2A; regulates G1 phase progression, the G2/M phase transition, microtubule dynamics, the osmoresponse, bud morphogenesis and DNA repair; subunit of the Tap42p-Sit4p-Rrd1p complex","phosphatase regulatory protein",
YJL083W,TAX4,"Protein involved in regulation of phosphatidylinositol 4,5-bisphosphate concentrations; Irs4p and Tax4p bind and activate the phosphatase Inp51p","phosphatase regulatory protein",
YJL098W,SAP185,"Protein that forms a complex with the Sit4p protein phosphatase and is required for its function","phosphatase regulatory protein",
YKL190W,CNB1,"Calcineurin B","phosphatase regulatory protein",
YKL193C,"SDS22 (EGP1)","Conserved nuclear regulatory subunit of Glc7p type 1 protein serine-threonine phosphatase (PP1), functions positively with Glc7p to promote dephosphorylation of nuclear substrates required for chromosome transmission during mitosis","phosphatase regulatory protein",
YKR019C,IRS4,"Protein involved in regulation of phosphatidylinositol 4,5-bisphosphate concentrations; Irs4p and Tax4p bind and activate the phosphatase Inp51p; mutation confers an increase in rDNA silencing","phosphatase regulatory protein",
YKR028W,SAP190,"Protein that forms a complex with the Sit4p protein phosphatase and is required for its function","phosphatase regulatory protein",
YLL011W,SOF1,"Essential subunit of the U3 (box C+D) snRNP complex required for 2' O-methylation of pre-RNA; has similarity to the beta subunit of trimeric G-proteins and the splicing factor Prp4p","phosphatase regulatory protein",
YLR273C,PIG1,"Putative targeting subunit for the type-1 protein phosphatase Glc7p that tethers it to the Gsy2p glycogen synthase","phosphatase regulatory protein",
YML100W,TSL1,"Large subunit of trehalose 6-phosphate synthase (Tps1p)/phosphatase (Tps2p) complex, which converts uridine-5'-diphosphoglucose and glucose 6-phosphate to trehalose, homologous to Tps3p and may share function","phosphatase regulatory protein",
YML109W,"ZDS2 (CES4)","Protein that interacts with silencing proteins at the telomere, involved in transcriptional silencing; paralog of Zds1p","phosphatase regulatory protein",
YMR120C,ADE17,"Enzyme of 'de novo' purine biosynthesis containing both 5-aminoimidazole-4-carboxamide ribonucleotide transformylase and inosine monophosphate cyclohydrolase activities, isozyme of Ade16p; ade16 ade17 mutants require adenine and histidine","phosphatase regulatory protein",
YMR261C,TPS3,"Regulatory subunit of trehalose-6-phosphate synthase/phosphatase complex, which synthesizes the storage carbohydrate trehalose; expression is induced by stress conditions and repressed by the Ras-cAMP pathway","phosphatase regulatory protein",
YMR273C,"ZDS1 (CES1, CKM1, NRC1, OSS1)","Protein that interacts with silencing proteins at the telomere, involved in transcriptional silencing; has a role in localization of Bcy1p, a regulatory subunit of protein kinase A; implicated in mRNA nuclear export","phosphatase regulatory protein",
YMR311C,GLC8,"Regulatory subunit of protein phosphatase 1 (Glc7p), involved in glycogen metabolism and chromosome segregation; proposed to regulate Glc7p activity via conformational alteration; ortholog of the mammalian protein phosphatase inhibitor 2","phosphatase regulatory protein",
YNL201C,PSY2,"Nuclear protein of unknown function; deletion results in sensitivity to anticancer drugs oxaliplatin and cisplatin, but not mitomycin C; deletion is synthetically lethal with a chitin synthase (CHS1) null mutant","phosphatase regulatory protein",
YNL233W,BNI4,"Targeting subunit for Glc7p protein phosphatase, localized to the bud neck, required for localization of chitin synthase III to the bud neck via interaction with the chitin synthase III regulatory subunit Skt5p","phosphatase regulatory protein",
YNR034W,SOL1,"Protein with a possible role in tRNA export; shows similarity to 6-phosphogluconolactonase non-catalytic domains but does not exhibit this enzymatic activity; homologous to Sol2p, Sol3p, and Sol4p","phosphatase regulatory protein",
YOR014W,RTS1,"B-type regulatory subunit of protein phosphatase 2A (PP2A)","phosphatase regulatory protein",
YOR227W,,"Hypothetical protein","phosphatase regulatory protein",
YPL137C,GIP3,"Glc7-interacting protein whose overexpression relocalizes Glc7p from the nucleus and prevents chromosome segregation","phosphatase regulatory protein",
YPL152W,"RRD2 (YPA2)","Activator of the phosphotyrosyl phosphatase activity of PP2A; regulates G1 phase progression, the osmoresponse and microtubule dynamics; implicated in the spindle assembly check; subunit of the Tap42p-Pph21p-Rrd2p complex","phosphatase regulatory protein",
YPL228W,CET1,"Beta (RNA 5'-triphosphatase) subunit of the mRNA capping enzyme, a heterodimer (the other subunit is CEG1, a guanylyltransferase) involved in adding the 5' cap to mRNA; the mammalian enzyme is a single bifunctional polypeptide","phosphatase regulatory protein",
YBL085W,BOI1,"Protein implicated in polar growth, functionally redundant with Boi2p; interacts with bud-emergence protein Bem1p; contains an SH3 (src homology 3) domain and a PH (pleckstrin homology) domain","phosphoprotein binding",
YBR200W,BEM1,"Protein containing SH3-domains, involved in establishing cell polarity and morphogenesis; functions as a scaffold protein for complexes that include Cdc24p, Ste5p, Ste20p, and Rsr1p ","phosphoprotein binding",
YCR065W,HCM1,"Forkhead transcription factor involved in cell cycle specific transcription of SPC110; dosage-dependent suppressor of calmodulin mutants with specific defects in SPB assembly; involved in telomere maintenance","phosphoprotein binding",
YDR099W,BMH2,"14-3-3 protein, minor isoform; binds proteins and DNA, involved in regulation of many processes including exocytosis and vesicle transport, Ras/MAPK signaling during pseudohyphal development, rapamycin-sensitive signaling, and others","phosphoprotein binding",
YDR501W,PLM2,"Protein required for partitioning of the 2-micron plasmid","phosphoprotein binding",
YER114C,BOI2,"Protein implicated in polar growth, functionally redundant with Boi1p; interacts with bud-emergence protein Bem1p; contains an SH3 (src homology 3) domain and a PH (pleckstrin homology) domain","phosphoprotein binding",
YER177W,BMH1,"14-3-3 protein, major isoform; binds proteins and DNA, involved in regulation of many processes including exocytosis and vesicle transport, Ras/MAPK signaling during pseudohyphal development, rapamycin-sensitive signaling, and others","phosphoprotein binding",
YFL010C,WWM1,"WW domain containing protein of unknown function; binds to Mca1p, a caspase-related protease that regulates H2O2-induced apoptosis; overexpression causes Gi phase growth arrest and clonal death that is suppressed by overexpression of MCA1","phosphoprotein binding",
YGL227W,VID30,"Protein involved in proteasome-dependent catabolite degradation of fructose-1,6-bisphosphatase (FBPase); shifts the balance of nitrogen metabolism toward the production of glutamate; localized to the nucleus and the cytoplasm","phosphoprotein binding",
YGR116W,SPT6,"Essential protein that interacts with histones and is involved in nucleosome disassembly and reassembly during transcription elongation","phosphoprotein binding",
YHR115C,DMA1,"Protein involved in regulating spindle position and orientation, functionally redundant with Dma2p; homolog of S. pombe Dma1 and H. sapiens Chfr","phosphoprotein binding",
YIL131C,FKH1,"Transcription factor of the forkhead family that regulates the cell cycle and pseudohyphal growth; also involved in chromatin silencing at HML and HMR","phosphoprotein binding",
YJR017C,ESS1,"Peptidylprolyl-cis/trans-isomerase (PPIase) specific for phosphorylated serine and threonine residues N-terminal to proline; regulates phosphorylation of the RNA polymerase II large subunit (Rpo21p) C-terminal domain","phosphoprotein binding",
YLR016C,PML1,"Subunit of the RES complex, which is required for nuclear retention of unspliced pre-mRNAs; acts in the same pathway as Pml39p and Mlp1p","phosphoprotein binding",
YLR183C,TOS4,"Transcription factor that binds to a number of promoter regions, particularly promoters of some genes involved in pheromone response and cell cycle; potential Cdc28p substrate; expression is induced in G1 by bound SBF","phosphoprotein binding",
YLR238W,FAR10,"Protein involved in G1 cell cycle arrest in response to pheromone, in a pathway different from the Far1p-dependent pathway; interacts with Far3p, Far7p, Far8p, Far9p, and Far11p; potential Cdc28p substrate","phosphoprotein binding",
YNL068C,FKH2,"Transcription factor of the forkhead family that regulates the cell cycle and pseudohyphal growth; also involved in chromatin silencing at HML and HMR; potential Cdc28p substrate","phosphoprotein binding",
YNL116W,DMA2,"Protein involved in regulating spindle position and orientation, functionally redundant with Dma1p; homolog of S. pombe Dma1 and H. sapiens Chfr","phosphoprotein binding",
YPR104C,FHL1,"Putative transcriptional regulator with similarity to DNA-binding domain of Drosophila forkhead; required for rRNA processing","phosphoprotein binding",
YPR152C,URN1,"Pre-mRNA splicing factor that is associated with the U2-U5-U6 snRNPs, the RES complex, and the Prp19-associated complex (NTC); null mutation displays synthetic genetic interactions with mutations affecting U2 snRNA and pre-mRNA splicing factors","phosphoprotein binding",
YAL017W,PSK1,"One of two (see also PSK2) PAS domain containing S/T protein kinases","protein kinase",
YAR018C,KIN3,"Nonessential protein kinase with unknown cellular role","protein kinase",
YBL009W,,haspin,"protein kinase",
YBL016W,FUS3,"Mitogen-activated protein kinase involved in mating pheromone response","protein kinase",
YBL088C,TEL1,"Protein kinase, primarily involved in telomere length regulation","protein kinase",
YBL105C,PKC1,"Protein serine/threonine kinase essential for cell wall remodeling during growth","protein kinase",
YBR028C,,"Hypothetical protein","protein kinase",
YBR059C,AKL1,"Ser-Thr protein kinase, member (with Ark1p and Prk1p) of the Ark kinase family; involved in endocytosis and actin cytoskeleton organization ","protein kinase",
YBR136W,MEC1,"Genome integrity checkpoint protein and PI kinase superfamily member","protein kinase",
YBR160W,CDC28,"Catalytic subunit of the main cell cycle cyclin-dependent kinase (CDK)","protein kinase",
YBR274W,CHK1,"DNA damage checkpoint effector kinase, mediates mitotic cell cycle arrest via phosphorylation of Pds1p","protein kinase",
YCL024W,KCC4,"Protein kinase of the bud neck involved in the septin checkpoint, associates with septin proteins, negatively regulates Swe1p by phosphorylation, shows structural homology to bud neck kinases Gin4p and Hsl1p","protein kinase",
YCR008W,SAT4,"Ser/Thr protein kinase involved in salt tolerance","protein kinase",
YCR073C,SSK22,"MAP kinase kinase kinase of the HOG1 mitogen-activated signaling pathway","protein kinase",
YCR091W,KIN82,"Putative serine/threonine protein kinase, most similar to cyclic nucleotide-dependent protein kinase subfamily and the protein kinase C subfamily","protein kinase",
YDL017W,CDC7,"DDK (Dbf4-dependent kinase) catalytic subunit required for firing origins and replication fork progression in mitosis through phosphorylation of Mcm2-7p complexes and Cdc45p","protein kinase",
YDL025C,,"Protein of unknown function, potentially phosphorylated by Cdc28p","protein kinase",
YDL079C,MRK1,"Glycogen synthase kinase 3 (GSK-3) homolog","protein kinase",
YDL101C,DUN1,"Cell-cycle checkpoint serine-threonine kinase required for DNA damage-induced transcription of certain target genes, phosphorylation of Rad55p and Sml1p, and transient G2/M arrest after DNA damage","protein kinase",
YDL108W,KIN28,"Serine/threonine protein kinase, subunit of the transcription factor TFIIH","protein kinase",
YDL214C,PRR2,"Protein kinase with a possible role in MAP kinase signaling in the pheromone response pathway","protein kinase",
YDR122W,KIN1,"Serine/threonine protein kinase involved in regulation of exocytosis","protein kinase",
YDR247W,VHS1,"Cytoplasmic serine/threonine protein kinase","protein kinase",
YDR283C,GCN2,"Protein kinase, phosphorylates the alpha-subunit of translation initiation factor eIF2 (Sui2p) in response to starvation","protein kinase",
YDR466W,PKH3,"Protein kinase with similarity to mammalian phosphoinositide-dependent kinase 1 (PDK1) and yeast Pkh1p and Pkh2p, two redundant upstream activators of Pkc1p","protein kinase",
YDR477W,SNF1,"AMP-activated serine/threonine protein kinase found in a complex containing Snf4p and members of the Sip1p/Sip2p/Gal83p family","protein kinase",
YDR490C,PKH1,"Serine/threonine protein kinase involved in sphingolipid-mediated signaling pathway that controls endocytosis, PKA-related","protein kinase",
YDR507C,GIN4,"Protein kinase involved in bud growth and assembly of the septin ring, proposed to have kinase-dependent and kinase-independent activities","protein kinase",
YDR523C,SPS1,"Putative protein serine/threonine kinase expressed at the end of meiosis and localized to the prospore membrane, required for correct localization of enzymes involved in spore wall synthesis","protein kinase",
YER123W,YCK3,"Palmitoylated, vacuolar membrane-localized casein kinase I isoform","protein kinase",
YER129W,SAK1,"Upstream kinase for the SNF1 complex","protein kinase",
YFL029C,CAK1,"Cyclin-dependent kinase-activating kinase required for passage through the cell cycle, phosphorylates and activates Cdc28p","protein kinase",
YFL033C,RIM15,"Glucose-repressible protein kinase involved in signal transduction during cell proliferation in response to nutrients, specifically the establishment of stationary phase","protein kinase",
YFR014C,CMK1,"Calmodulin-dependent protein kinase","protein kinase",
